product_id,product_name,merchant,item_type,category,price_min,price_max
967,Teh Celup Sariwangi 25 Bags,Indomaret,Needs,Groceries,6500,8000
968,Teh Celup Sosro 30 Bags,Alfamart,Needs,Groceries,6000,7500
969,Mie Instan Indomie Goreng 1 Pcs,Warung Kelontong,Needs,Groceries,3100,3500
970,Mie Instan Indomie Soto 1 Pcs,Warung Kelontong,Needs,Groceries,3000,3400
971,Mie Sedaap Goreng 1 Pcs,Warung Kelontong,Needs,Groceries,3000,3400
972,Mie Telur Cap 3 Ayam Indofood 200g,Indomaret,Needs,Groceries,5000,7000
973,Bihun Jagung Padamu 300g,Pasar Tradisional,Needs,Groceries,8000,10000
974,Santan Bubuk Sasa Sachet,Warung Kelontong,Needs,Groceries,3000,4000
975,Agar-Agar Swallow Globe Sachet,Warung Kelontong,Wants,Groceries,4000,5000
976,Nutrijell Coklat Sachet,Indomaret,Wants,Groceries,5000,7000
977,Pudding Susu Nutrijell Box,Alfamart,Wants,Groceries,12000,15000
978,Sirup Marjan Cocopandan Botol 460ml,Indomaret,Wants,Groceries,20000,25000
979,Sirup ABC Squash Delight Botol 460ml,Alfamart,Wants,Groceries,13000,15000
980,Minyak Goreng Filma Pouch 2 Liter,Superindo,Needs,Groceries,41000,44000
981,Tepung Bumbu Sasa Fried Chicken 225g,Indomaret,Needs,Groceries,6000,8000
982,Tepung Bumbu Kobe 200g,Alfamart,Needs,Groceries,7000,9000
983,Kerupuk Udang Mentah Finna 250g,Superindo,Wants,Groceries,15000,20000
984,Macaroni La Fonte 225g,Indomaret,Wants,Groceries,9000,11000
985,Spaghetti La Fonte 450g,Alfamart,Wants,Groceries,18000,20000
986,Saus Pasta La Fonte Bolognese Pouch 315g,Superindo,Wants,Groceries,18000,22000
987,Bubur Ayam Instan Super Bubur Cup,Indomaret,Needs,Groceries,5000,7000
988,Energen Cereal Vanilla Chocolate Renceng 10s,Alfamart,Needs,Groceries,20000,22000
989,Quaker Oats Instant 800g,Superindo,Needs,Groceries,45000,50000
990,Madu TJ Murni Botol 150g,Indomaret,Wants,Groceries,20000,25000
991,Madu Rasa Sachet Box 12s,Warung Kelontong,Wants,Groceries,12000,15000
992,Meses Holland 250g,Toko Bahan Kue,Wants,Groceries,15000,18000
993,Selai Kacang Morin 150g,Superindo,Wants,Groceries,20000,25000
994,Selai Strawberry Morin 150g,Alfamart,Wants,Groceries,18000,22000
995,Tepung Ketan Rose Brand 500g,Pasar Tradisional,Needs,Groceries,8000,10000
996,Minyak Goreng Bimoli Pouch 2 Liter,Indomaret,Needs,Groceries,39000,43000
997,Gula Halus Claris 250g,Toko Bahan Kue,Wants,Groceries,6000,8000
998,Tepung Hunkwe Lokal Pack,Pasar Tradisional,Needs,Groceries,3000,5000
999,Sabun Mandi Lifebuoy Total 10 Refill 400ml,Indomaret,Needs,Personal Care,21000,25000
1000,LIFEBUOY BODY WASH LEMON FRESH 825ML,Alfamart,Needs,Personal Care,32900,38000
1001,Sabun Cair Biore Guard Merah 450ml,Superindo,Needs,Personal Care,22500,28000
1002,BIORE BODY FOAM RELAXING AROMATIC 800ML,Hypermart,Needs,Personal Care,38000,45000
1003,Lux Botanicals Sabun Cair Soft Rose 400ml,Indomaret,Needs,Personal Care,20000,24000
1004,LUX Body Wash Magical Orchid Refill 825ml,Shopee - Unilever,Needs,Personal Care,35000,42000
1005,Dettol Body Wash Original 410g,Guardian,Needs,Personal Care,28000,35000
1006,DETTOL SABUN MANDI CAIR COOL 800G,Watsons,Needs,Personal Care,55000,65000
1007,Sabun Batang Lifebuoy Merah 4x110g,Alfamidi,Needs,Personal Care,18000,22000
1008,Sabun Mandi Nuvo Family Biru 450ml,Toko Kelontong,Needs,Personal Care,16000,19000
1009,Shinzui Body Cleanser Kirei 400ml,Indomaret,Needs,Personal Care,23000,27000
1010,SHINZUI SKIN LIGHTENING SOAP 3X80G,Alfamart,Needs,Personal Care,13000,16000
1011,Zen Body Wash Shiso & Sulphur 400ml,Superindo,Needs,Personal Care,24000,29000
1012,GIV Body Wash White Flowers 450ml,Lotte Mart,Needs,Personal Care,17000,21000
1013,Dove Body Wash Deeply Nourishing 400ml,Watsons,Wants,Personal Care,35000,45000
1014,The Body Shop Shower Gel Moringa 250ml,The Body Shop,Wants,Personal Care,129000,149000
1015,Original Source Shower Gel Mint 250ml,Guardian,Wants,Personal Care,38000,45000
1016,Sabun Asepso Sulphur 80gr,Apotek K-24,Needs,Personal Care,8000,10000
1017,JF Sulfur Sabun Mandi Anti Acne,Century,Needs,Personal Care,12000,15000
1018,Herborist Body Wash Zaitun 250ml,Tokopedia,Wants,Personal Care,22000,28000
1019,Shampoo Sunsilk Black Shine 170ml,Indomaret,Needs,Personal Care,21000,26000
1020,SUNSILK SHAMPOO SOFT & SMOOTH 340ML,Alfamart,Needs,Personal Care,38000,45000
1021,Pantene Shampoo Anti Ketombe 160ml,Indomaret,Needs,Personal Care,23000,28000
1022,PANTENE SHAMPOO HAIR FALL 290ML,Superindo,Needs,Personal Care,42000,52000
1023,Pantene Conditioner 3 Minute Miracle 150ml,Guardian,Wants,Personal Care,28000,35000
1024,Clear Shampoo Ice Cool Menthol 160ml,Alfamidi,Needs,Personal Care,22000,27000
1025,CLEAR MEN SHAMPOO COOL SPORT 300ML,Hypermart,Needs,Personal Care,45000,55000
1026,Head & Shoulders Cool Menthol 160ml,Indomaret,Needs,Personal Care,24000,30000
1027,H&S Shampoo Lemon Fresh 300ml,Watsons,Needs,Personal Care,48000,58000
1028,Rejoice Shampoo Rich Soft Smooth 150ml,Toko Kelontong,Needs,Personal Care,19000,24000
1029,Dove Shampoo Total Damage Treatment 135ml,Indomaret,Needs,Personal Care,22000,27000
1030,Tresemme Keratin Smooth Shampoo 170ml,Guardian,Wants,Personal Care,32000,38000
1031,Zinc Shampoo Refreshing Cool 170ml,Alfamart,Needs,Personal Care,18000,22000
1032,Selsun Blue Shampoo 120ml,Apotek K-24,Needs,Personal Care,45000,55000
1033,Makarizo Hair Energy Shampoo 170ml,Watsons,Wants,Personal Care,28000,35000
1034,Serasoft Shampoo Hair Fall 170ml,Superindo,Needs,Personal Care,20000,25000
1035,Emeron Shampoo Black Shine 170ml,Toko Kelontong,Needs,Personal Care,16000,19000
1036,L'Oreal Paris Elseve Fall Resist Shampoo,Guardian,Wants,Personal Care,55000,65000
1037,Pepsodent Pencegah Gigi Berlubang 190g,Indomaret,Needs,Personal Care,13000,16000
1038,PEPSODENT WHITE 225G,Alfamart,Needs,Personal Care,16000,20000
1039,Pepsodent Action 123 Herbal 190g,Superindo,Needs,Personal Care,18000,22000
1040,Ciptadent Maxi 12 Plus Fresh Mint 190g,Toko Kelontong,Needs,Personal Care,10000,13000
1041,Close Up Green Ever Fresh 160g,Indomaret,Needs,Personal Care,18000,23000
1042,Sensodyne Pasta Gigi Rapid Relief 100g,Watsons,Needs,Personal Care,35000,45000
1043,SENSODYNE REPAIR & PROTECT 100G,Guardian,Needs,Personal Care,42000,52000
1044,Formula Pasta Gigi Strong Protector 160g,Alfamidi,Needs,Personal Care,12000,15000
1045,Enzim Classic Mild Pasta Gigi 100ml,Superindo,Wants,Personal Care,30000,38000
1046,Darlie Double Action Toothpaste 225g,Hypermart,Needs,Personal Care,28000,35000
1047,Listerine Cool Mint Mouthwash 250ml,Indomaret,Needs,Personal Care,22000,26000
1048,Listerine Zero Alcohol 500ml,Watsons,Needs,Personal Care,38000,48000
1049,Betadine Obat Kumur 190ml,Apotek K-24,Needs,Personal Care,35000,42000
1050,Sikat Gigi Formula Ripple Soft Isi 3,Alfamart,Needs,Personal Care,15000,18000
1051,Pepsodent Sikat Gigi Double Care,Indomaret,Needs,Personal Care,10000,14000
1052,Garnier Men Acno Fight Foam 100ml,Indomaret,Needs,Personal Care,32000,38000
1053,GARNIER MEN TURBOLIGHT OIL CONTROL 100ML,Alfamart,Needs,Personal Care,32000,38000
1054,Pond's Men Energy Charge Face Wash 100g,Indomaret,Needs,Personal Care,30000,36000
1055,Kahf Oil and Acne Care Face Wash 100ml,Shopee - Kahf,Needs,Personal Care,38000,45000
1056,Kahf Skin Energizing Face Wash 100ml,Tokopedia - Kahf,Needs,Personal Care,38000,45000
1057,Biore Men's Double Scrub Facial Foam 100g,Alfamidi,Needs,Personal Care,28000,34000
1058,Nivea Men Facial Foam Dark Spot 100ml,Superindo,Needs,Personal Care,30000,36000
1059,Garnier Light Complete Foam 100ml (Wanita),Indomaret,Needs,Personal Care,28000,34000
1060,Pond's Facial Foam White Beauty 100g,Alfamart,Needs,Personal Care,27000,33000
1061,Senka Perfect Whip Facial Foam 120g,Watsons,Wants,Personal Care,55000,65000
1062,Cetaphil Gentle Skin Cleanser 125ml,Guardian,Wants,Personal Care,95000,115000
1063,Rexona Men Roll On Ice Cool 45ml,Indomaret,Needs,Personal Care,18000,22000
1064,REXONA WOMEN DEO ROLL ON FREE SPIRIT 45ML,Alfamart,Needs,Personal Care,18000,22000
1065,Nivea Men Black & White Deo Roll On 50ml,Superindo,Needs,Personal Care,20000,25000
1066,Nivea Extra Brightening Deo Roll On 50ml,Indomaret,Needs,Personal Care,20000,25000
1067,Dove Deodorant Roll On Original 40ml,Watsons,Wants,Personal Care,24000,30000
1068,Posh Men Body Spray Cool Blue 150ml,Alfamart,Needs,Personal Care,25000,30000
1069,AXE Deodorant Body Spray Dark Temptation,Indomaret,Wants,Personal Care,35000,42000
1070,Gatsby Splash Cologne 175ml,Toko Kelontong,Needs,Personal Care,12000,15000
1071,Vitalis Body Scent Blossom 100ml,Alfamidi,Wants,Personal Care,18000,23000
1072,Laurier Relax Night Wing 35cm 12 Pads,Indomaret,Needs,Personal Care,18000,22000
1073,LAURIER ACTIVE DAY SUPER MAXI 30P,Alfamart,Needs,Personal Care,19000,23000
1074,Charm Body Fit Day Wing 23cm 18 Pads,Superindo,Needs,Personal Care,16000,20000
1075,Charm Safe Night Wing 29cm 10 Pads,Indomaret,Needs,Personal Care,15000,18000
1076,Softex Daun Sirih Slim 23cm 20 Pads,Alfamart,Needs,Personal Care,17000,21000
1077,Softex Celana Menstruasi All Size 2s,Watsons,Wants,Personal Care,18000,24000
1078,Hers Protex Daily Comfort 20 Pads,Toko Kelontong,Needs,Personal Care,12000,15000
1079,Betadine Feminine Hygiene 60ml,Apotek Century,Needs,Personal Care,30000,38000
1080,Sumber Ayu Pembersih Kewanitaan 90ml,Alfamart,Needs,Personal Care,18000,22000
1081,My Baby Minyak Telon Plus 60ml,Indomaret,Needs,Personal Care,18000,23000
1082,MY BABY MINYAK TELON PLUS 150ML,Alfamart,Needs,Personal Care,38000,45000
1083,Cussons Baby Oil Soft & Smooth 100ml,Superindo,Needs,Personal Care,20000,25000
1084,Zwitsal Baby Bath Hair & Body 450ml Refill,Hypermart,Needs,Personal Care,35000,42000
1085,Cussons Baby Powder Mild & Gentle 350g,Indomaret,Needs,Personal Care,15000,19000
1086,MamyPoko Pants X-tra Kering M 34,Alfamart,Needs,Personal Care,55000,65000
1087,Sweety Silver Pants L 28,Indomaret,Needs,Personal Care,58000,68000
1088,Merries Pants Good Skin XL 26,Superindo,Needs,Personal Care,65000,75000
1089,Tisu Wajah Paseo Smart 250 Sheets,Indomaret,Needs,Personal Care,12000,15000
1090,NICE FACIAL TISSUE 900 GRAM,Alfamart,Needs,Personal Care,35000,42000
1091,Tisu Basah Mitu Baby Ganti Popok 50s,Indomaret,Needs,Personal Care,14000,18000
1092,Kapas Selection Facial Cotton 35g,Alfamart,Needs,Personal Care,5000,7000
1093,Kapas Selection Lapis Tipis 175s,Watsons,Needs,Personal Care,15000,19000
1094,Cotton Buds Cussons 100s,Indomaret,Needs,Personal Care,6000,9000
1095,Dettol Hand Sanitizer Original 50ml,Guardian,Needs,Personal Care,15000,20000
1096,Antis Hand Sanitizer Spray Jeruk Nipis 55ml,Alfamart,Needs,Personal Care,12000,16000
1097,Gillette Pisau Cukur Blue II Plus 2s,Indomaret,Needs,Personal Care,18000,22000
1098,Gillette Foamy Shaving Cream Lime 175g,Watsons,Wants,Personal Care,45000,55000
1099,Charm Body Fit Wing 23cm 20 Pads,Modern Retail,Needs,Personal Care,16000,20000
1100,Charm Body Fit Non-Wing 23cm 20 Pads,Modern Retail,Needs,Personal Care,14000,18000
1101,Charm Night Wing 29cm 10 Pads,Modern Retail,Needs,Personal Care,12000,15000
1102,Laurier Relax Night Wing 30cm 16 Pads,Modern Retail,Needs,Personal Care,18000,23000
1103,Laurier Active Day Super Maxi 30 Pads,Modern Retail,Needs,Personal Care,19000,24000
1104,Softex Daun Sirih Wing 23cm 20 Pads,Modern Retail,Needs,Personal Care,15000,19000
1105,Softex Daun Sirih Non-Wing 23cm 20 Pads,Modern Retail,Needs,Personal Care,13000,17000
1106,Khong Guan Biskuit Merah Kaleng 1600g,Khong Guan,Wants,Snacks,95000,110000
1107,Roma Kelapa Biskuit 300g,Mayora,Wants,Snacks,10000,13000
1108,Roma Malkist Crackers 135g,Mayora,Wants,Snacks,6000,8000
1109,Oreo Vanilla Roll 133g,Mondelez,Wants,Snacks,8000,10000
1110,Oreo Chocolate Roll 133g,Mondelez,Wants,Snacks,8000,10000
1111,Beng Beng Wafer Coklat 20g (Box isi 20),Mayora,Wants,Snacks,30000,35000
1112,Nabati Wafer Richeese Keju 132g,Nabati,Wants,Snacks,8000,11000
1113,Qtela Keripik Singkong Balado 60g,Indofood,Wants,Snacks,5500,7000
1114,Chitato Sapi Panggang 68g,Indofood,Wants,Snacks,10000,13000
1115,Potabee Potato Chips Seaweed 68g,Wings Food,Wants,Snacks,9000,12000
1116,Japota Potato Chips Honey Butter 68g,Wings Food,Wants,Snacks,9000,12000
1117,Silverqueen Cashew 62g,Delfi,Wants,Snacks,14000,18000
1118,Silverqueen Almond 62g,Delfi,Wants,Snacks,14000,18000
1119,Cadbury Dairy Milk 62g,Mondelez,Wants,Snacks,15000,19000
1120,Kinder Joy Boy 20g,Ferrero,Wants,Snacks,12000,15000
1121,Kinder Joy Girl 20g,Ferrero,Wants,Snacks,12000,15000
1122,Kopiko Candy Sachet (Pack 150g),Mayora,Wants,Snacks,7000,9000
1123,Relaxa Candy Barley Mint (Pack 125g),Mayora,Wants,Snacks,7000,9000
1124,Chitato Lite Nori Seaweed 68g,Indofood,Wants,Snacks,10000,12500
1125,Chitato Ayam Bumbu 68g,Indofood,Wants,Snacks,10000,13000
1126,Pringles Potato Crisps Original 102g,Kellogg's,Wants,Snacks,23000,26000
1127,Pringles Potato Crisps Sour Cream 102g,Kellogg's,Wants,Snacks,23000,26000
1128,Kusuka Keripik Singkong Original 180g,Arnotts,Wants,Snacks,14000,17000
1129,Happytos Tortilla Chips Merah 140g,Modern Retail,Wants,Snacks,10000,12500
1130,Piattos Snack Kentang Sapi Panggang 75g,URC Indonesia,Wants,Snacks,10000,12500
1131,Taro Net Seaweed 65g,Tiga Pilar,Wants,Snacks,6000,8000
1132,Chiki Balls Keju 55g,Indofood,Wants,Snacks,6500,8500
1133,French Fries 2000 Premium 62g,Siantar Top,Wants,Snacks,7500,9500
1134,Twistko Jagung Bakar 70g,Siantar Top,Wants,Snacks,7500,9500
1135,Tango Wafer Coklat 130g,Orang Tua,Wants,Snacks,8500,11000
1136,Tango Wafer Vanilla 130g,Orang Tua,Wants,Snacks,8500,11000
1137,Selamat Wafer Chocolate 145g,Delfi,Wants,Snacks,15000,18000
1138,Nabati Richoco Wafer Coklat 132g,Nabati,Wants,Snacks,8000,11000
1139,Beng Beng Share It Pouch 95g,Mayora,Wants,Snacks,13000,16000
1140,Gery Saluut Malkist Coklat 110g,GarudaFood,Wants,Snacks,7000,9000
1141,Roma Malkist Abon 135g,Mayora,Wants,Snacks,8500,11000
1142,Roma Sari Gandum 115g,Mayora,Wants,Snacks,7500,9500
1143,Slai Olai Strawberry 128g,Mayora,Wants,Snacks,8000,10000
1144,Good Time Chocochip Cookies 72g,Arnotts,Wants,Snacks,7500,9500
1145,Nextar Brownies Choco Delight 106g,Nabati,Wants,Snacks,8000,10000
1146,Regal Marie Biscuits 230g,Regal,Wants,Snacks,22000,26000
1147,Tim Tam Chocolate Biscuit 81g,Arnotts,Wants,Snacks,9500,12000
1148,Astor Wafer Stick Coklat 150g,Mayora,Wants,Snacks,14000,17000
1149,Hello Panda Chocolate 45g,Meiji,Wants,Snacks,8500,10500
1150,Pocky Chocolate Stick 47g,Glico,Wants,Snacks,8500,10500
1151,Pocky Strawberry Stick 45g,Glico,Wants,Snacks,8500,10500
1152,Lotte Choco Pie 168g (Isi 6),Lotte,Wants,Snacks,17000,21000
1153,Delfi Dairy Milk Chocolate 60g,Delfi,Wants,Snacks,13000,16000
1154,Delfi Cashew Chocolate 60g,Delfi,Wants,Snacks,15000,18000
1155,Silverqueen Chunky Bar Cashew 95g,Delfi,Wants,Snacks,23000,28000
1156,KitKat 4 Fingers 35g,Nestle,Wants,Snacks,9000,11000
1157,Cadbury Cashew Nut 62g,Mondelez,Wants,Snacks,15000,19000
1158,Yupi Gummy Burger 100g,Yupi,Wants,Snacks,11000,14000
1159,Yupi Strawberry Kiss 120g,Yupi,Wants,Snacks,11000,14000
1160,Mentos Mint Roll 37g,Perfetti Van Melle,Wants,Snacks,4000,6000
1161,Foxs Crystal Clear Berries 90g,Nestle,Wants,Snacks,8500,11000
1162,Fishermans Friend Original 25g,Modern Retail,Wants,Snacks,16000,20000
1163,Sugus Stick Permen Lunak,Wrigley,Wants,Snacks,5000,7000
1164,Nano Nano Kulit Jeruk 10g,Konimex,Wants,Snacks,3000,5000
1165,Garuda Kacang Kulit 375g,GarudaFood,Wants,Snacks,32000,38000
1166,Garuda Kacang Atom 130g,GarudaFood,Wants,Snacks,9500,12000
1167,Dua Kelinci Sukro Original 130g,Dua Kelinci,Wants,Snacks,9500,12000
1168,Dua Kelinci TicTac Sapi Panggang 90g,Dua Kelinci,Wants,Snacks,7000,9000
1169,Mister Potato Crisps Original 85g,Modern Retail,Wants,Snacks,14000,17000
1170,Tao Kae Noi Crispy Seaweed 32g,Tao Kae Noi,Wants,Snacks,38000,45000
1171,Momogi Stick Jagung Bakar (Box isi 20),Sari Murni,Wants,Snacks,10000,13000
1172,Sponge Crunch Coklat 120g,Oishi,Wants,Snacks,13000,16000
1173,Oishi Pillows Coklat 110g,Oishi,Wants,Snacks,11000,14000
1174,Soyjoy Almond Chocolate 30g,Otsuka,Wants,Snacks,10000,12500
1175,Fitbar Chocolate 22g,Kalbe,Wants,Snacks,5500,7500
1176,Roma Sandwich Coklat 189g,Mayora,Wants,Snacks,9000,12000
1177,Gery Chocolatos Wafer Stick (Box isi 24),GarudaFood,Wants,Snacks,19000,23000
1178,Nyam Nyam Rice Crispy 45g,Arnotts,Wants,Snacks,5000,7000
1179,Better Sandwich Biscuit (Pack isi 10),Mayora,Wants,Snacks,16000,20000
1180,Kalpa Wafer Coklat Kelapa (Pack isi 12),Mayora,Wants,Snacks,22000,26000
1181,Superstar Wafer Coklat (Box isi 12),Mayora,Wants,Snacks,12000,15000
1182,Top Sereal Bar Coklat 24g,Delfi,Wants,Snacks,2000,3000
1183,Roma Wafello Coklat 117g,Mayora,Wants,Snacks,7500,9500
1184,Nissin Crispy Crackers 225g,Nissin,Wants,Snacks,14000,17000
1185,Uniqlo Men Oxford Shirt Short Sleeve,Uniqlo Indonesia,Needs,Fashion,349000,349000
1186,Uniqlo Washable Milano Ribbed Crew Neck Sweater,Uniqlo Indonesia,Wants,Fashion,499000,499000
1187,Uniqlo Airism Cotton Oversized T-Shirt,Uniqlo Indonesia,Needs,Fashion,199000,199000
1188,Uniqlo Women Rayon Blouse,Uniqlo Indonesia,Needs,Fashion,399000,399000
1189,Uniqlo Smart Ankle Pants,Uniqlo Indonesia,Needs,Fashion,499000,499000
1190,Uniqlo Leggings Pants,Uniqlo Indonesia,Needs,Fashion,299000,299000
1191,Uniqlo Ultra Light Down Jacket,Uniqlo Indonesia,Need,Fashion,899000,899000
1192,Uniqlo Reversible Parka,Uniqlo Indonesia,Need,Fashion,499000,499000
1193,Uniqlo Canvas Sneakers,Uniqlo Indonesia,Need,Fashion,399000,399000
1194,Uniqlo UV Protection Hat,Uniqlo Indonesia,Want,Fashion,299000,299000
1195,H&M T-shirt Oversized,H&M Indonesia,Want,Fashion,499900,499900
1196,H&M Atasan Jersey Lengan Panjang Oversized,H&M Indonesia,Want,Fashion,299900,299900
1197,H&M Kemeja Luar Flanel Regular Fit,H&M Indonesia,Want,Fashion,499900,499900
1198,H&M Kaos Krah-Leher Longgar Cetakan,H&M Indonesia,Want,Fashion,199900,199900
1199,H&M Kemeja Katun Fit Santai,H&M Indonesia,Needs,Fashion,349900,349900
1200,H&M Kaos Polo Rajut Kabel,H&M Indonesia,Want,Fashion,249900,249900
1201,H&M Jeans Regular Lurus,H&M Indonesia,Needs,Fashion,499900,499900
1202,H&M Jeans Bootcut Santai,H&M Indonesia,Want,Fashion,599900,599900
1203,H&M Jeans Santai,H&M Indonesia,Want,Fashion,499900,499900
1204,H&M Hoodie Potongan Longgar,H&M Indonesia,Want,Fashion,399900,399900
1205,H&M Overshirt Campuran Wol,H&M Indonesia,Want,Fashion,699900,699900
1206,H&M Overshirt Nilon Berlapis,H&M Indonesia,Want,Fashion,599900,599900
1207,H&M Dress Kaos Ribbed,H&M Indonesia,Want,Fashion,249900,249900
1208,H&M Sepatu Bot Kulit (Boots),H&M Indonesia,Want,Fashion,4599000,4599000
1209,H&M Sneakers Chunky,H&M Indonesia,Want,Fashion,599000,599000
1210,H&M Topi Jerami (Straw Hat),H&M Indonesia,Want,Fashion,199900,199900
1211,Zara Kemeja Linen Wanita,Zara Indonesia,Want,Fashion,599900,599900
1212,Zara Top Corset Style,Zara Indonesia,Want,Fashion,450000,450000
1213,Zara Celana Panjang Barrel Korduroi,Zara Indonesia,Want,Fashion,1099000,1099000
1214,Zara Celana Panjang Lebar Pinggang Dobel,Zara Indonesia,Want,Fashion,899900,899900
1215,Zara Celana Jogger Linen,Zara Indonesia,Want,Fashion,359900,359900
1216,Zara Celana Panjang Pinggang Jogger,Zara Indonesia,Want,Fashion,899900,899900
1217,Zara Blazer Oversize,Zara Indonesia,Want,Fashion,1299000,1299000
1218,Zara Bomber Jacket,Zara Indonesia,Want,Fashion,999000,999000
1219,Zara Dress Linen Midi,Zara Indonesia,Want,Fashion,999900,999900
1220,Zara Dress Satin Slip,Zara Indonesia,Want,Fashion,799900,799900
1221,Zara Sepatu Hak Tinggi (Heels),Zara Indonesia,Want,Fashion,899000,899000
1222,Erigo T-Shirt Basic Maroon White,Erigo Store,Needs,Fashion,59999,65000
1223,Erigo Shanghai Short Sleeve Basic Farhan Sage,Erigo Store,Needs,Fashion,113000,120000
1224,Erigo T-Shirt Uchino White,Erigo Store,Needs,Fashion,59999,65000
1225,Erigo Kaos Distro Summer Project,Erigo Store,Want,Fashion,59900,70000
1226,Erigo Kaos Erigo X JKT48 Official Vol 3,Erigo Store,Want,Fashion,300000,350000
1227,Erigo Kaos Erigo X JKT48 Official Vol 2,Erigo Store,Want,Fashion,300000,350000
1228,Erigo Timnas Indonesia Away Jersey 2024 (Erspo),Erigo Store,Want,Fashion,1299000,1350000
1229,Erigo Flannel Shirt Red,Erigo Store,Want,Fashion,150000,175000
1230,Erigo Relax Chino Pants Errol Black,Erigo Store,Needs,Fashion,247000,260000
1231,Erigo Relax Chino Pants Erven Olive,Erigo Store,Want,Fashion,247000,260000
1232,Erigo Chino Pants Flexi Fit Elvis Beige,Erigo Store,Needs,Fashion,124999,135000
1233,Erigo Cargo Pants Olive,Erigo Store,Want,Fashion,185000,200000
1234,Erigo Coach Jacket (Windbreaker),Erigo Store,Want,Fashion,185000,200000
1235,Erigo Erspo Official Timnas Jacket,Erigo Store,Want,Fashion,899000,950000
1236,3Second Greenlight T-Shirt Regular Fit Mild Cotton,3Second Store,Needs,Fashion,99000,110000
1237,3Second Kaos Wanita in Clear Water,3Second Store,Needs,Fashion,69750,80000
1238,3Second Greenlight Kaos Pria 100822,3Second Store,Needs,Fashion,89500,100000
1239,3Second Kaos Polos V-Neck,3Second Store,Needs,Fashion,89000,95000
1240,3Second Short Pants OL-C070924,3Second Store,Want,Fashion,249000,260000
1241,Greenlight Celana Panjang Wanita 030722,3Second Store,Needs,Fashion,159750,170000
1242,Moutley Men's Casual Boardshort Nylon,3Second Store,Want,Fashion,167600,180000
1243,3Second Men's Hoodie Short Sleeve,3Second Store,Want,Fashion,137400,150000
1244,Greenlight High Collar Jacket Parachute,3Second Store,Needs,Fashion,499000,520000
1245,Greenlight Sweater Pria 050622,3Second Store,Needs,Fashion,174750,185000
1246,3Second Jaket Greenlight Famo Promo,3Second Store,Needs,Fashion,167310,180000
1247,3Second Hoodie Jumper Pullover,3Second Store,Needs,Fashion,109900,120000
1248,3Second Topi Distro,3Second Store,Want,Fashion,85000,95000
1249,Aerostreet T-Shirt Polos Gelap,Aerostreet,Needs,Fashion,59900,65000
1250,Aerostreet Kaos Oversize Streetwear,Aerostreet,Want,Fashion,75000,85000
1251,Aerostreet Chinos Panjang Elvano Hitam,Aerostreet,Needs,Fashion,139900,150000
1252,Aerostreet Chinos Panjang Elvano Krem,Aerostreet,Needs,Fashion,139900,150000
1253,Aerostreet Hoodie Graphic,Aerostreet,Want,Fashion,119000,130000
1254,Aerostreet Hoops Low 2.0 Putih Hitam,Aerostreet,Needs,Fashion,170905,180000
1255,Aerostreet Brooklyn Hitam,Aerostreet,Needs,Fashion,180405,190000
1256,Aerostreet Massive Low Hitam Natural,Aerostreet,Needs,Fashion,183104,195000
1257,Aerostreet Sandal Eros Slip On,Aerostreet,Needs,Fashion,59900,70000
1258,Aerostreet Livy Putih (Women),Aerostreet,Needs,Fashion,169900,180000
1259,Aerostreet Ortiz Natural Abu,Aerostreet,Needs,Fashion,193903,200000
1260,Aerostreet Socks Sport Levi,Aerostreet,Needs,Fashion,14900,20000
1261,Aerostreet Topi Snapback,Aerostreet,Want,Fashion,50000,60000
1262,Levi's Blue Tab Men's Relaxed Tee,Levi's Store,Want,Fashion,350000,400000
1263,Levi's Men's Work Shirt,Levi's Store,Want,Fashion,750000,800000
1264,Levi's 501 Original Fit Jeans (Men),Levi's Store,Want,Fashion,1499900,1600000
1265,Levi's 501 '93 Straight Fit Selvedge,Levi's Store,Want,Fashion,2499900,2600000
1266,Levi's Vintage Clothing 1955 501,Levi's Store,Want,Fashion,4499900,4600000
1267,Levi's 501 90s Jeans (Women),Levi's Store,Want,Fashion,1580000,1700000
1268,Levi's Ribcage Wide Leg Jeans,Levi's Store,Want,Fashion,1580000,1700000
1269,Levi's 512 Slim Taper Jeans,Levi's Store,Want,Fashion,1499000,1600000
1270,Levi's 578 Baggy Jeans,Levi's Store,Want,Fashion,1580000,1700000
1271,Levi's Naval Sack Coat,Levi's Store,Want,Fashion,3799900,3900000
1272,Levi's Fishtail Parka Jacket,Levi's Store,Want,Fashion,2500000,2600000
1273,Levi's Scout Jacket,Levi's Store,Want,Fashion,2200000,2300000
1274,Adidas Trefoil Essentials Tee,Adidas Store,Want,Fashion,600000,650000
1275,Adidas Liverpool FC 25/26 Home Jersey,Adidas Store,Want,Fashion,1200000,1300000
1276,Adidas Squadra 25 Jersey,Adidas Store,Want,Fashion,350000,400000
1277,Adidas Germany 26 Home Jersey,Adidas Store,Want,Fashion,1200000,1300000
1278,Adidas Brain Dead Jersey,Adidas Store,Want,Fashion,1900000,2000000
1279,Adidas Adicolor Classics Sprinter Shorts,Adidas Store,Want,Fashion,1000000,1100000
1280,Adidas Brain Dead Track Pant,Adidas Store,Want,Fashion,2200000,2300000
1281,Adidas Techfit Compression Tights,Adidas Store,Need,Fashion,500000,550000
1282,Adidas Minecraft Training Short,Adidas Store,Want,Fashion,580000,650000
1283,Adidas Adicolor Classics SST Track Jacket,Adidas Store,Want,Fashion,1500000,1600000
1284,Adidas Brain Dead Noragi Jacket,Adidas Store,Want,Fashion,3000000,3200000
1285,Adidas Anthem Jacket,Adidas Store,Want,Fashion,1100000,1200000
1286,Adidas Dropset 4 Training Shoes,Adidas Store,Want,Fashion,2400000,2500000
1287,Adidas Dropset Control,Adidas Store,Want,Fashion,1400000,1500000
1288,Adidas Adicolor Classics Sneakers,Adidas Store,Want,Fashion,1500000,1600000
1289,Adidas Samba OG,Adidas Store,Want,Fashion,2200000,2400000
1290,Adidas Baseball Cap Cotton,Adidas Store,Want,Fashion,300000,350000
1291,Nike Sportswear Tee,Nike Store,Want,Fashion,450000,500000
1292,Nike Pro Women's Mid-Rise Biker Shorts,Nike Store,Want,Fashion,550000,600000
1293,Nike Windrunner Jacket,Nike Store,Want,Fashion,1250000,1350000
1294,Nike Air Max Plus III,Nike Store,Want,Fashion,2391200,2500000
1295,NikeCourt Lite 4 (Women),Nike Store,Want,Fashion,1149000,1250000
1296,Nike Pegasus Plus Road Running,Nike Store,Want,Fashion,2849000,3000000
1297,Nike Free 2025 Women's Workout,Nike Store,Want,Fashion,1549000,1650000
1298,Nike Kobe III Protro Basketball,Nike Store,Want,Fashion,3169000,3300000
1299,Nike Air Jordan Mule Golf,Nike Store,Want,Fashion,1549000,1650000
1300,Nike Dunk Low Retro Premium,Nike Store,Want,Fashion,2199000,2300000
1301,Nike Alphafly 3 'Eliud Kipchoge',Nike Store,Want,Fashion,4289000,4500000
1302,Nike Zoom Fly 6,Nike Store,Want,Fashion,2849000,3000000
1303,Nike Vomero 18 (Women),Nike Store,Want,Fashion,2249000,2400000
1304,Nike ReactX Rejuven8,Nike Store,Want,Fashion,1069000,1200000
1305,Nike Gato LV8,Nike Store,Want,Fashion,1729000,1850000
1306,Nike JA 3 'Price of Admission',Nike Store,Want,Fashion,1909000,2000000
1307,Nike Pegasus 41 'Eliud Kipchoge',Nike Store,Want,Fashion,2199000,2300000
1308,Nike Air Jordan 1 Low G,Nike Store,Want,Fashion,2149000,2250000
